id,name,anonymous,hostProgramName,graduatingYear,isAlumni,jobTitle,tagline,createdAt,queryDate,program,overallScore,overall,curriculum,jobSupport,review_body,school
269343,Felipe,0,NULL,2020,0,Unemployed,"UX UI Iron Hack Sao Paulo, be careful before you sign up. Excellent curriculum, but poor customer service.",10/13/2020,2020-10-13,"UX/UI Design Bootcamp",3.3,2.0,5.0,3.0,"(Por favor copie e cole no google tradutor se você é um futuro estudante e esta pesquisando sobre qual escola ir) Covid 19, lost my Grandpa, lost two businesses, went completely bank corrupt, and decided to sign up for the boot camp because was always... Read More one of my dreams and I used to be a very big Fã of iron hack. The boot camp for its self was perfect, a lot of things happened in my personal life in the middle and they were very supportive. But in the end, they are lacking in their customer service for their older students, they claim to have a slack Channel but they don't answer you there, they promise a T-shirt for everyone, which is very SIMPLE, and until today we got nothing, as I also need to review some of the classes that I had because they said that each class was being recorded (on zoom) and in fact was, but they won't answer you back when you need, I already sent two emails and yes they read it already ( i have a tool that shows that), but nothing, it's so frustrating because I still need to finish my portfolio to start looking for jobs, but before I wanna see a few things that I forgot, BUT they don't answer, come on guys, for a really expansive Bootcamp and a school like you guys, you guys will really fail with me because of a simple email?I even referred you guys to a friend in Portugal, and yes he joined you guys because of me. It's really frustrating. Hope this can help you guys before you signing up. It's so sad to see how you guys really get me, got my money, and left alone in the middle of a pandemic, and yes, why I say that? Because you guys promise me that everything was going to be okay, and it's not! I just need the link for the recording class, that's it! I Paid for that, that's why I think it’s the minimum thing that I could get back from you guys.Read Less",ironhack
269201,"Ozzie Zamora",0,NULL,2020,0,"UI Designer","UX/UI Design Part-Time | Miami",10/7/2020,2020-10-07,"UX/UI Design Part-Time",5.0,5.0,5.0,5.0,"A truly amazing experience, to be honest. I was part of the Part-Time UX Design course for 6 months, and I cannot really describe how much I enjoyed the process. For me, it was life-changing. I came into class with minimal background in design and walked... Read More out the door with a wide range of skillsets (from UX Research, Design Thinking, UI Design software technical skills to even project management and communication, etc.). The Ironhack Miami classroom environment is beautiful, and its location is a jewel (in the heart of Brickell).But the real value of Ironhack Miami resides in its people and staff. The social interactions, professional network, and friends that you are going to make there are gold. I cannot thank enough to my design instructors Snezana, Juno, and Jade. Big THANKS also to Brito, the Digital Talent &amp; Business Development Manager, for his constant support and advice after graduation in the Job Hunt process.All I can say is that a year ago, I was frustrated in a job with no growth, no passion, no recognition for my efforts, and today I am moving into a full-time UI Design role in a big company in the middle of a pandemic with a tough job market. Still cannot believe it, my life is about to change, and Ironhack was definitely the trigger.THANK YOU IRONHACK MIAMI SO MUCH!!!Personal advises:- If you can, create a little design foundation by learning before joining the course (Youtube, etc.). This will make you stand out- PLEASE never stop learning, during, and even after the course. Be curious and try to learn as much as you can by yourself. Just the course is not going to make you land the job or a pro. You need to have the drive and passion for it (this is were most of the people fail after the course, in my opinion)- Participate in meetups and reach out to the community for help if necessary, do not be afraidRead Less",ironhack
269141,"Sacha Dollé",0,NULL,2020,0,"Data Analyst","Great bootcamp, great team, great learning",10/6/2020,2020-10-06,"Data Analytics Bootcamp",5.0,5.0,5.0,5.0,"I use to work in advertisement and decided to move into data through a bootcamp.I was in Paris' June Data Analysis bootcamp, which were 100% remote due to sanitary reasons.The lessons were very clear, really intense of course, but the teacher were here... Read More for us exactly as if we were on the campus.We've learned a lot throught those 9 weeks, and people are always amazed to realize all we were able to learn efficiently in such a short time.I'm really glad I had the chance to attend this bootcamp, because today I'm a proud Data Analyst.Read Less",ironhack
269133,"Calypso Redor",0,NULL,2020,0,"Product Designer","Une superbe expérience",10/6/2020,2020-10-06,,5.0,5.0,5.0,5.0,"« On m’avait prévenu de ce que voulait dire « bootcamp » mais je ne m’attendais pas à un tel rythme », c’est ce que j’ai beaucoup dit en présentant la formation ironhack UX/UI. En deux mot, cette formation est une superbe expérience. Étant déjà familiaire... Read More avec le métier j’avais de grandes attentes pour cette formation et je n’en suis pas déçue. J’ai été impressionné par la qualité de l’enseignement et de l’évolution des étudiants en si peu de temps. Nous avons beaucoup appris, les projets ont étés tres formateurs. L’entraide et l’ambiance générale ont été assez exceptionnels. Nous avons réalisé la formation à distance et ce fut tellement concluant que je compte travailler en entreprise full remote très bientôt.Read Less",ironhack
269115,"Linda Mai Phung",0,NULL,2020,0,"Product Designer","Intensive as promised, supportive teachers and staffs members, good content.",10/5/2020,2020-10-05,,4.3,5.0,5.0,3.0,"I am very satisfied of my training this summer at Ironhack Paris. Even with the pandemic issues, the classes were taught easily via videoconference. I did lack the human vibe sometimes but fortunately, we could access the campus and meet with other classmates.... Read More Bootcamp: it is a very challenging training as it will take most of your evenings and week-ends (and your whole brain and mind) to learn, design and collaborate but it truly worths it: I have no hesitation anymore to prepare and rock presentations, work with a team and talk product strategy with my clients. Indeed, this training makes you confident enough to work for any early stage start-up and as a junior ux/ui designer even if you have no background in design. For the career program however, be sure to confirm what you really will get as there are re-adjusting their offer according to the current covid- situation.Read Less",ironhack
269104,"Alice Prigent",0,NULL,2020,0,,"A unique and enriching experience!",10/5/2020,2020-10-05,"Web Development Bootcamp",4.3,5.0,4.0,4.0,"I am delighted to have been able to realize a web development bootcamp at IronHack. Despite the context (covid-19), the classes went well and we received quality instruction. The pedagogical team is listening and accompanies the students as well as possible... Read More throughout the training. The content of the training is very relevant, and favors the integration into the job market after the bootcamp. As is the career service that helps us find a job after the training. A great experience, I will do it again without hesitation!Read Less",ironhack
269103,"Manon Morgaut",0,NULL,2020,0,,"Intensive but definitely worth it",10/5/2020,2020-10-05,"Web Development Bootcamp",5.0,5.0,5.0,NULL,"I decided to follow Ironhack's program in the context of changing jobs from sales to Product Management. The objective was to develop the necessary tech skills to better collaborate with a dev team in my future job. The bootcamp I followed was from June... Read More to August 2020 meaning everything was done remotely. In general I am very satisfied with this course. They have managed to adapt smoothly to only-remote classes and even in this context I found it very easy to learn and work with the other students. The morning was dedicated to class and afternoon to labs. One needs to bear in mind that this is an intensive bootcamp hence the need to dedicate some time outside the class hours to go through the class material or review the classes of the day. It took a little bit of time for me to realize that and I went through some quite anxious phases when at some points I was realizing I was completely lost!What I particularly liked was the fact that for my final project I was given the freedom to do it my way: I decided to follow a product management methodology to develop the app I was working on, meaning I spent a lot of time doing discovery before actually starting the development phase, and both the teacher and TA supported me on this initiative.Read Less",ironhack
269102,Rohini,0,NULL,2020,0,"UX UI Designer","A very complete and Interesting Experience even in the lockdown!",10/5/2020,2020-10-05,"UX/UI Design Bootcamp",4.7,5.0,4.0,5.0,"I had no experience in the field of UX UI Designer, today I'm able to have and analyze a User experience from A to Z.Thanks to the teacher who explain very well and were always with us when we needed. They were able to manage even during lockdownthank... Read More you for this wonderful experience!!Read Less",ironhack
269045,"Fanny Sabin",0,NULL,2020,0,,"Amazing experience, highly recommended !",10/2/2020,2020-10-02,"Web Development Bootcamp",5.0,5.0,5.0,5.0,"I attended Ironhack FullTime Web Developement bootcamp and I was totally satisfied with this learning experience. I had no coding experience before taking the course so it was really challenging, but the courses are made not only to give a good baseground... Read More for technical skills but also give you all the tools to prepare you after the bootcamp to go further and continue developing your skills.I had excellent teachers that were highly skilled, always ready to help and really open to new suggestions. The Ironhack staff is also very supportive and always ensures that everyone feels comfortable during the learning process. If I can give some advice, just be sure you take enough time on the prework and you’re ready to be 100% involved in an intense but amazing experience. I highly recommend this bootcamp!Read Less",ironhack
269020,"Charlotte Noguer",0,NULL,2020,0,"CoFounder of Botcave SAS","Awesome Bootcamp",10/1/2020,2020-10-01,"Web Development Bootcamp",5.0,5.0,5.0,5.0,"I has been years since I worked in the tech environment and really wanted to take a part in it.Ironhack helped me understand all those lines, logic and processes behind our web applications.Sure, it was intense, but It has been a long time since I had... Read More been this passionate about a subject, and wow, this feeling when you resolve a bug or when you make everything work... it's just amazing. It was a great time spend with the Ironhack team and my fellow Ironhakers (and even more because our cohort had many women in it!).I loved the group projects and the overall group dynamic, how the teacher and TA where there for us and really helped us and how for each module we had a time to make some feedback to improve our learning process (reviewing the practices that really worked for us, those that worked less, and make suggestions to improve our global experience).Oh, and the ironbeers, even on remote, where a total delight.I'm glad I picked Ironhack, first because I wanted to learn JS , second because they feel concerned about women in tech, and third because they really want to make the bootcamp a great experience and souvenir for you.Read Less",ironhack
269010,"Orane Lefevre",0,NULL,2020,0,"UX designer","Great experience, you learn a lot in those 10 weeks!",10/1/2020,2020-10-01,"UX/UI Design Bootcamp",4.7,5.0,5.0,4.0,"I really enjoyed my experience at Ironhack Paris. We did the class in a hybrid format due to covid-19 where the campus was open to students but all classes were virtual. I was impressed by the professionalism and the adaptability of the teaching staff... Read More , who managed to deliver a great experience despite de conditions.The curriculum is fast-paced, you will have to put in a lot of effort but it is worth it. You can see how much you've learned week after week and it is very valuable. I feel ready ton take on a UX job after the bootcamp.Read Less",ironhack
268969,Anonymous,1,NULL,2020,0,,"Quick dive into data",9/30/2020,2020-09-30,"Data Analytics Bootcamp",3.7,4.0,4.0,3.0,"Friendly environment with knowledgeable tutor, I cannot do it any better with online learning platforms.The 9 weeks is in fact 8 weeks comprised of 4 days intensive classes + labs and 1 day (in reality and the weekend) of project work. The final week... Read More was dedicated for the final project.The journey started long (dependent how you deal with deadlines/preparations) before the bootcamp with the introduction to git, python, sql and statistics. I highly recommend taking the time to absorb those information to form strong foundation for the upcoming challenge.Along the way, the supportive Ironhack team would check in to ensure you that the emotional rollercoaster is completely normal, I recommend speaking up with the rest of your class to share the experience, soon you will learn that you are not alone.The material covered are just deep enough to provide enough guidance for future work, let's be honest 8 weeks is a short time to cover everything. The most important is to deliver the mindset of questioning what is in front of you, and the toolkit and understanding to be able to do your own research faster.The projects and the subsequent presentation of your work is a valuable experience, however I was expecting to have one of the project to be teamed up with a company to provide some career network/progression for after the bootcamp.Overall, very happy with the learning experience, the career support could be a bit better for post bootcamp experience. After all, one of the top three reason for any one attending a bootcamp is to attain a career in the field.Read Less",ironhack
268800,Anonymous,1,NULL,2019,0,"Data  analyst","Not much better than taking an udemy course",9/25/2020,2020-09-25,"Data Analytics Bootcamp",2.3,2.0,1.0,4.0,"I took the Data analyst course. The other students were nice overall, i had nice people experience. I think the teachers are also ok.The material is super outdated and very low level. They use materials from 2016-2017, some of them are not actual and... Read More many of the source materials are not available. Teachers upload missing data to google drive as they realize its missing, but we still use outdated stuff.Learning portals(Udemy, Coursera etc) vs IronhackLearning material: Learning portals: 10/10, very up to date, and huge selection.Ironhack: 3/10, outdated and the same for years without change. They don't even take effort to find out tasks, you have to do them.Price:Learning portals: 10/10 , from free, super cheapIronhack: 2/10, 7000$, can be much, much more at other bootcamp schoolsTeacher knowledge:Learning portals: 10/10, the greatest minds are sharing their knowledge.Ironhack 3/10: They definately are not stupid. And they do their best I'm assuming. But its not compareable.Hours included:Learning portals: as much as you wantIronhack: 400ish(half of them are 'standups' and 'games' which are not fun super useless and really do take a lot of time away).Actual hours put in:Learning portals: 2/10, usually people slack off because its free/cheap and there is no time limit.Ironhack: 7/10, as above, you pay and you want to get something for your money so you slack less.Paper for people with no PHD:Learning portals: 3/10, if you can actually do what is in your 'certifications', the sky is the limit. But just the certificate itself doesn't worth shit.Ironhack: 2/10, same as above, but since you can only learn less, you can't show up more.Career support:Learning portals: usually close to 0Ironhack: I did not attend this, i was disappointed enough in the 10 weeks. I don't expect anything big, the only 'alumni' they could get to talk to us as previous student was a super lowlvl job(the guy was cool though so no offense there).This could be said about all courses and bootcamps on the world, but from online courses you can get refunds super easily if you dont like something, so its easier to select out the trash. With bootcamps you pay thousands of dollars with no hope of a refund if its shit.TLDR: Overall experience:I'm not sure what I expected from this, I was new to the field and wanted to jump in somehow, just learning a few hours every now and then was not really effective. So in a way it was good, because I spent the time on learning, not on playing games etc. Also i did not have to work during the 10 week with full salary because of covid. So i only regret it halfsy.Don't do any bootcamps if you can sit down by yourself to study/read stuff. The only reason to pick a bootcamp is because you can't get yourself to sit down and learn. If you can, online learning is the way.Oh i almost forgot: Teachers, TAs and job supporters were many times late and cancelling appointments(during full lockdown, they were working from home but cancelled the hours!!)Read Less",ironhack
268746,Anonymous,1,NULL,2020,0,,"Great bootcamp to kick-off your technical ramp-up",9/24/2020,2020-09-24,"Web Development Bootcamp",4.7,5.0,5.0,4.0,"I attended Ironhack Paris Web Development bootcamp, it was a great learning experience.The learning path is made to acquire concrete technical skills during 9 very intensive weeks.It was extremely rewarding to be able to already code all aspects of a... Read More web application at the end (we developped 3 projets during the bootcamp).It is perfect if you want to quickly kick-off your transition in that domain or ramp-up on those technologies. On the other hand, not being able to go really go deep on all topics to follow the courses flow was a bit frustrating. Bootcamp format gives you nice groundings to start your ramp-up, but keep in mind that a lot of work remain after to develop your expertise.There was a great spirit between classmates and with Ironhack team. Teachers were excellent and opened to suggestions.Read Less",ironhack
268442,"Rafael de Lázaro",0,NULL,2020,0,"Full Stack Web Developer","A challenge that constantly pushes you forward",9/14/2020,2020-09-14,"Web Development Bootcamp",5.0,5.0,5.0,5.0,"This has been a very intense experience, and one I am extremely happy to have lived. The bootcamp provides an excellent learning environment, with amazing teachers, comprehensive learning materials, scrum daily meetings... You can take it without prior... Read More coding experience, but it does not hold your hand: you will get from it as much as you are willing to put in it. Expect long days of work, with some calmer ones and fun activities in between. The feeling of accomplishment you get when you see your own web apps online is just amazing. After the technical bootcamp there is a week they call careerhack where you will get some really good counseling on how to make the best out of your job search. Here too I found very good support materials and the coach was just excellent.I definitely recommend it, but clear your schedule for the next 10 weeks. This will become your life during that time.Read Less",ironhack
268440,Lanette,0,NULL,2020,0,"Fullstack Web Developer","Intense and life-changing!",9/14/2020,2020-09-14,,5.0,5.0,5.0,5.0,"Yes, the bootcamp is challenging. You make long hours and really need to invest everything you can. But, the rewards are great. You'll learn so much in a short amount of time. Not only about coding but also about pair programming, the professional world... Read More of development and projectmanagement. And I was very fortunate to have a great teacher with a lot of experience teaching remotely, making the remote-environment very enjoyable. I had high expectations coming in, but I can honestly say that Ironhack has surpassed them. One thing to keep in mind is that you will definitely not be done learning after Ironhack. Ironhack gives you all the tools and knowledge you need to get a very good start and possibly land a job as (Junior) Web Dev, but you will have to keep put in the effort and learn more yourself afterwards. But as this is also necessary for the job of web dev in general, that shouldn't surprise you or hold you back.Read Less",ironhack
268236,"Irina Buruiana",0,NULL,2020,0,"Learning and Development Specialist","Ironhack overpromises your career expectancies",9/4/2020,2020-09-04,"UX/UI Design Part-Time",1.7,1.0,3.0,1.0,"I have been a part time student at Ironhack Berlin, UX/UI design course from January 2020- until June 2020. I want to make a career change from cognitive psychology to UX Design. I chose the bootcamp for the course, but mostly for their promises in connecting... Read More us with companies, having fast track interviews. I hoped that this will make my transition smoother.During my class, Corona Pandemic hit which forced us to move all the classes online. Cons:- we had our teacher changed, as it was not meeting with the expectations of the course during the course, which made us lose classes and the part of UX Research for example for damaged as it was not the speciality of the teacher itself- we are done since one month and a half and we haven't had any fast track interviews, any connection with any companies, anything in terms of job search. We have paid 6000 euros only for an online course.- our career coach quite just before we started our Career week leaving us with no guidance or follow up.Conclusion: We haven't had any help with our job search and the communication with the management is very blurry and not at all transparent.Advantages:- Muri, the teacher that came afterwards was amazing and we learned a lot from it- The projects are very well structured.I am writing this review as I believe it is fair to know for what you are paying. When I entered the course I was not aware of this flaw and I feel that the Bootcamp itself is not worth the money they are asking.Read Less",ironhack
268202,"Francisco Ponce",0,NULL,2020,0,"Fullstack Web Developer","Immersive, challenging and fast-paced, you won't regret.",9/3/2020,2020-09-03,"Web Development Bootcamp",5.0,5.0,5.0,5.0,"I was a little bit reluctant to take the bootcamp on remote when the COVID19 pandemic started, I thought it wouldn't be the same experience on-site, but after the first week, I knew I had no idea what I was talking about. The classes are fast-paced, there... Read More is no time to take a deep breath and recap a lesson you don't remember, well at some point you will by actually coding. Don't worry, there are tons of labs to practice, and for some reason everything will make sense and you won't know why. LT's are coding rockstars that are always willing to help you achieve your goals. Staff is committed with your academic and professional path.Read Less",ironhack
268193,"Aide Ruiz Rebolledo",0,NULL,2020,0,"Ux/Ui Designer","Invest in real education in short time.",9/2/2020,2020-09-02,"UX/UI Design Bootcamp",5.0,5.0,5.0,5.0,"The cons : Pricy or expensiveThe pros:Learn to use technology to work from the distanceSince then you do not feel by yourselfFeel part of a strong community Left on you the believe on yourself and none stop learning Intense but no waste more time that... Read More you need for achieve the knowledgeRead Less",ironhack
268172,"Emmanuel Solano",0,NULL,2020,0,"Junior Front End Developer","Fast paced and immersive course. You eat and breath code.",9/1/2020,2020-09-01,"Web Development Bootcamp",5.0,5.0,5.0,5.0,"Ok, lets start with the *Pros:-The fastest way to really learn the basics for web development.-Very effective way to switch career and land a job as a developer.-You will meet super interesting people.*Cons: -People with really 0 experience could find... Read More this Bootcamp a little challenging. (I highly recommend to previously take some courses in Free Code Camp, Codecademy, Udemy, etc. to really take advantage of the program and teachers)-You have to be commited with the Bootcamp AND NOTHING ELSE MORE for about 2 months.Read Less",ironhack
268130,"Diana Odiaka- Obiagwu",0,NULL,2020,0,"Full Stack Developer",Empowering!,8/31/2020,2020-08-31,"Web Development Bootcamp",5.0,5.0,5.0,5.0,"The most intense 9 weeks of my life that led to me gaining a most valuable skill set, built on a great foundation while being supported by the best team in the world! Ironhack is fast-paced but information rich. I went in thinking i will definitely not... Read More learn anything because it’s so fast paced but 9 weeks down the line, I feel Empowered because I know so much and I know I am equiped to go work anywhere my skills as a fullstack developer is required.Read Less",ironhack
268094,"Filipe Freire",0,NULL,2020,0,"Web Developer","Life Changing! (Lisbon Campus)",8/30/2020,2020-08-30,"Web Development Bootcamp",4.3,4.0,5.0,4.0,"My experience doing the Full Time Web Development bootcamp at Ironhack exceeded my expectations. I was a bit worried because of the COVID-19 situation, all the classes being transferred to remote, but it turned out to be amazingly more productive. It... Read More is very intense and fast paced, so have that in mind if you're looking to apply! Nonetheless, Ironhack's team really makes the whole experience worth it as they support you all the way and do their best to assist you every step of the way. The Syllabus is very complete and reflects a lot what the market is searching for at this time, which makes it easier to look for a job right after the bootcamp. Overall, I have definitely come a long way since I first started and I'd easily recommend Ironhack to other aspiring web developers!Read Less",ironhack
268049,"Joan Concha",0,NULL,2020,0,,"Wonderful experience",8/29/2020,2020-08-29,"Data Analytics Bootcamp",5.0,5.0,5.0,5.0,"At the beginning, I wasn't sure about joining the bootcamp (I even though about quiting after the first week), but it turned out the be one of the best decisions I've ever made. The Curriculum of the Data Analytics course is great and complete, it gives... Read More you more than the basics to follow a Data Science career. The professor and the teacher assistants are great and very helpful, I believe they are the main reason of the success of the D.A. course. I would love to come back as a web development student in the future!!Read Less",ironhack
267977,"Chaba Josa",0,NULL,2020,0,"Junior Software Developer","Best decision I have ever taken",8/28/2020,2020-08-28,"Web Development Bootcamp",4.7,5.0,5.0,4.0,"I got into coding because I thought automating the boring stuff with Python would help my social media manager duties, which it sure did, but this wasn't the only thing that happened while learning the basics of code. I found there was a whole world a... Read More didn't know about, a world where you can build anything with unlimited materials. Right then and there, I knew programming was going to be huge for me, so I started looking for coding schools, and as soon as I found Ironhack it just clicked. In just 9 weeks, I would learn in-demand job skills and have a shot at becoming a software developer? To be honest, at first, it sounded a little too good to be true, but I'm here to tell you it very much is. Ironhack was the one thing that truly helped find my passion for coding through raw knowledge, teamwork, and camaraderie. If I had to do a million times over, I would do it without blinking. Shoutout to the most awesome instructors and TAs in the world: Niko Tzikas, Juan Grajales, and Stefan Culafic (AKA Spuderman).Read Less",ironhack
267864,"Edgar Arturo Mora Zea",0,NULL,2020,0,"React Developer","FullStack Developer",8/25/2020,2020-08-25,"Web Development Part-Time",5.0,5.0,5.0,5.0,"La principal característica a favor es el horario, ya que te permite trabajar y asistir al curso, otra característica es el temario ya que se encuentra actualizado para que al salir te encuentres identificado con el Mercado, por último, los ejercicios... Read More y proyectos están enfocados en aplicar lo aprendido en la clase y a lo largo del móduloRead Less",ironhack
267742,"Dionel Elias Panuncia",0,NULL,2020,0,"Web developer","It was tough it wasn't easy but was it worth it? Absolutely.",8/23/2020,2020-08-23,"Web Development Bootcamp",5.0,5.0,5.0,5.0,"I'm glad with my experience in Ironhack, Starting off as someone that only understood basic html and css to building full scale websites using react js and mongoDB in less then 3 months should already tell you that this institution means business. The... Read More TA's here are truly one of a kind and very devoted to helping you understand what you're doing.Read Less",ironhack
267640,Anonymous,1,NULL,2020,0,"Product Designer","Intensive as promised, supportive teachers and staffs members, good content.",8/20/2020,2020-08-20,,4.3,5.0,5.0,3.0,"This bootcamp makes you confident to jump into the job market as a UX-UI Designer after only 9 weeks of class and a final professional projet! Unfortunately, due to the covid issues, all the content was taught via video conference: it went totally fine... Read More but I personally thought communication was not easy when working collectively or for fun social gathering like friday beers... However, I enjoyed having the choice to study from home/my countryside getaway whenever I wanted to and how caring and dedicated the teachers and staff were. Do not expect to participate to a job dating fair as described in the former program, everything has changed since Covid, and there are adjusting (For our class, the HR will hunt jobs and introduce each of us to 1-2 companies). Just make sure to cover all details before enrolling to avoid disappointment. I was at the Paris Campus in June 2020 and if I could, I'd do it again!Read Less",ironhack
267597,"Laura Kaddour-Assia",0,NULL,2020,0,"UX-UI designer","Overwall really good experience",8/19/2020,2020-08-19,"UX/UI Design Bootcamp",3.7,4.0,4.0,3.0,"I got into the Bootcamp during the Corona Pandemic. They reacted in a really good way and we did our bootcamp remotely. The learning material is good however it looks too much to the lesson during the pre-work. Cool projects. It is really intense but... Read More it's part of the deal. The job support at the end was pretty poor I would say because the person in charge left with a short notice ( I'm pretty sure it was not her fault ) so I couldn't have a lot of talk with her.Read Less",ironhack
267588,"Michael Rehnert",0,NULL,2020,0,"Full Stack Web Developer","Put in the effort, and Ironhack will match you step for step.",8/19/2020,2020-08-19,"Web Development Bootcamp",4.7,5.0,4.0,5.0,"It's not a walk in the park, let me make that clear. If I had to sum it up, and I know it sounds cliche, but you get out of it what you put into it. And I know some of you are like, well I paid the tuition money. No, that's not what I mean. The money... Read More is beside the point. Whether you want to invest that money in yourself or waste it is up to you, and you'll decide that in nine short weeks. To sum it all up, Ironhack is totally worth the money, effort, and stress. If you want a coding bootcamp that will match your best efforts step for step, you can stop searching now-- Ironhack is your golden ticket to the good life. Just don't expect to have your hand held all the way. That's not to say the instructor cadre isn't awesome. They are beyond amazing, and so is the career advisor. But they are there to catch you if you fall - - you have to do the walking. Ask questions, stay hungry, stay motivated, and you'll never regret this decision. Read Less",ironhack
267583,Anonymous,1,NULL,2020,0,,"Just An Honest Review",8/18/2020,2020-08-18,"Web Development Bootcamp",4.0,4.0,4.0,4.0,"Overall, I'm happy about my experience in Ironhack. To preface, I had zero technical background and graduated so if I can do it, you can too! That being said, some things to consider ---1. It is a lot of hard work normally, but especially if you don't... Read More have a strong technical background get ready to put in extra work/time/dedication before and after class and through your weekends. 2. After all that grinding, you are able to produce 3 awesome projects (which you will be very proud of). However, your overall grasp on web development is still pretty shallow so be prepared to continue learning and deepening your knowledge even after graduation. This bootcamp is a great starting point! And lastly, 3. Even though this class is remote and invites students from anywhere, it is still focused towards South Florida particularly during Career Week where they help you search for jobs and prep you for interviews. Although they do teach you how to search for jobs (with this skill it's applicable to wherever you are), but many of their references to jobs, companies, connections, speakers, fast track interviews matchmaking system, etc. are all Florida-based, so people who don't live there may feel excluded. The career department for all USA students is a one man show - Granted he is very knowledgeable and has much wisdom to offer, but I hope Ironhack hires more people to support in this area as the graduates' career needs are surely growing and beyond the limits of just one person.Overall, the experience was good, the instructors were GREAT, I cried, I laughed, I learned a lot, and it's worth the money.Read Less",ironhack
267579,"Andrew H",0,NULL,2020,0,,"Great Learning Experience",8/18/2020,2020-08-18,"Web Development Bootcamp",5.0,5.0,5.0,5.0,"Overall, I'm very happy I decided to join Ironhack. I had been doing "self-education" on and off for a few years prior to joining, and Ironhack really helped to bring everything together for me. Instead of having bits and pieces of unrelated knowledge,... Read More Ironhack helped me to gain a coherent understanding of web development. The instructors were great, and I learned a lot. It's a significant financial investment, but I think it's well worth it. It's an intense curriculum and you have to remain disciplined throughout, but it's definitely do-able.Read Less",ironhack
267563,"Brandon Collada",0,NULL,2020,0,,"Best Experience Ever",8/18/2020,2020-08-18,"UX/UI Design Bootcamp",5.0,5.0,5.0,5.0,"Ironhack was an amazing experience and I am thankful for everyone who helped me on my journey! David is very knowledgable in UX design and he is a genuinely awesome dude. Juan, Niko, and Stefan are also great teachers from what I heard from the web dev... Read More students and they were always fun to work with! Brito is another amazing person in Ironhack who gives you some tough love but it is all with good intentions! Just make sure to stay focused and keep your eye on the prize. The 9 weeks will FLY by.Read Less",ironhack
267560,"Stephen Z",0,NULL,2020,0,,"Best Bootcamp",8/17/2020,2020-08-17,"Web Development Bootcamp",5.0,5.0,5.0,5.0,"First of all, as in middle of the COVID19, it was a lot of uncertainty to apply for a full time school, but the result is worth what you putted in. I was extremely impressed when I came into this program with just very limited knowledge of the program... Read More language. Instructors and TAs were very forth coming in their knowledge and extremely friendly also energetic helpful. Career support was also engaged to help with those who had graduated with their professional knowledge and skills. To be honest, this program definitely exceeded my expectations, I was glad I made this life change decision.Read Less",ironhack
267531,"Daniel Perez",0,NULL,2020,0,,Amazing,8/16/2020,2020-08-16,"Web Development Bootcamp",5.0,5.0,5.0,5.0,"As a current senior student studying computer science at a top university, I can truly say that attending Ironhack was the best decision I made this summer. I have learned way more in 9 weeks than I have learned pursing a four year degree. Yes, I have... Read More learned a lot of new technical skills but the best thing that got from Ironhack is the community of grads, that has no value. During careers week you will learn that sometimes it is not about what you know but about who you know and that is definitely important when job hunting. My experience with Ironhack was great and it has helped me in growing my passion for technology .Read Less",ironhack
267527,Anonymous,1,NULL,2020,0,,"Intense and complete bootcamp",8/16/2020,2020-08-16,"Web Development Bootcamp",5.0,5.0,5.0,5.0,"I took the 10-week Ironhack class this summer and I learned so much in such a short period of time. Individual and group work make you progress quickly as well as feedbacks from the teachers and TA. The rythme is pretty intense (so take it only if you're... Read More prepared to work a lot during 2 months) but the outcome is worth it. Of course you'll need to work on your own afterwards to master the concepts you've learned during the bootcamp but you'll be quite prepared for it :)Read Less",ironhack
267517,"Matthew Manzo",0,NULL,2020,0,,"Most Incredible Experience!",8/15/2020,2020-08-15,"Web Development Bootcamp",5.0,5.0,5.0,5.0,"As someone who didn't previously have a technical background, I wanted to find a school that would not only greatly improve my web development skills, but provide me with a network and framework for career support after the program as well. A few highlights... Read More below - The overall teaching and curriculum is exceptional. The instructors and TA's are amazing at taking foreign concepts and simplifying them and making them MUCH easier to understand. They're so supportive and encouraging every step of the way, and I'm as thankful as can be that they re-ignited my enjoyment and passion towards being a lifelong learner. I learned more in 9 weeks than I could've ever imagined, building awesome projects that may have once seemed impossible to do. The career guidance and support that you receive during and especially AFTER the program is equally impressive and exceptional. The program is so structured and geared towards innovative and unique job hunting methods that most aren't even aware of. Brito (the outcomes manager) is there for you every step of the way and is the most selfless person you'll ever meet, gearing his efforts towards seeing his students - past, present and future - succeed. The educational benefits and career opportunities that are brought by following the guidance of those at Ironhack are invaluable. I wholeheartedly recommend Ironhack and want to extend my sincerest appreciation, gratitude and thank you's to all those associated with the bootcamp.Read Less",ironhack
267514,Anonymous,1,NULL,2020,0,,"It was a good experience",8/15/2020,2020-08-15,"UX/UI Design Bootcamp",4.0,4.0,4.0,NULL,"It was veryyyy intense and sometimes you think maybe it is not a right way of learning something, but no way ....this is intense and you have to adapt yourself with that if you really want to shape your carrier. The teacher was a good person with a good... Read More knowledge in UX but he could be more friendly...I dont know, at least it is my feeling... and the TA was amazing person so helpful with a good knowledge in UI. I recommend this course ;)Read Less",ironhack
267500,"Hanna Murai",0,NULL,2020,0,,"Extremely satisfied with my experience",8/14/2020,2020-08-14,"Web Development Bootcamp",5.0,5.0,5.0,5.0,"When I decided to change my carrier, one of the hardest things was to find a right school. To be honest I’ve never thought about Ironhack , because I live in Dallas, TX and that’s why I was thinking to find something locally. When I started to look for... Read More a bootcamp, many offers were listed but all of them had very mixed reviews, then I heard about Ironhack from friend of mine who had recently graduated and already found a job  I’m so glad I’ve decided to go to Ironhack and very proud I have accomplished it. The bootcamp is intensive, very fast paced, but the curriculum is really good, instructors are extremely patient and dedicated.Read Less",ironhack
267375,"Chakib Bachir",0,NULL,2020,0,,"I definitely recommend Ironhack !",8/11/2020,2020-08-11,"Web Development Bootcamp",5.0,5.0,5.0,5.0,"I deeply recommend Ironhack.I feel like I’m advertising in this post, but I’m not. It’s just that I had the chance to compare two bootcamps. And if I had to do it all over again, I’d only recommend Ironhack and I will tell you why.The staff is very professional.... Read More Everyday, Katya (Program Manager) bends over backwards to make everything goes smoothly for every single student. Guillaume, Frank and Tatijana (teachers) were very patient, always checked that ALL students have understood the current topic before moving on so no-one was left behind. They never rushed a course. They even sometimes stayed late evening.You won't ever feel like being a customer but a Student. You want to enroll a School before anything else.Teachers were highly skilled but also extremely good at explaining. We had to submit our labs (assignments) daily that teachers review: good for tracking your progress and weak points !If you are looking for a job after the bootcamp, you will definitely appreciate Morgane’s help: she will give you all the tips you need, and much more.Unlike some other paris Bootcamps (I won't point them out), Ironhack offers:• High quality courses, a great student platform with super-rich and almost unlimited content. Not just a 5 line piece of code course :)• A real job support through CareerHack, and not just an “internship agreement”. :)• All the resources needed to become a Junior web developer: just work HARD and follow the instructions :)• More than 7000 other Alumnis from WebDev, Data Science, UX/UI ... we can interact with ! #Goldmine :)• Ironhack leads to a RNCP VI Certificate that equals a "Bac + 3/4" that's really recognized by the french state. No external certificate to take !• IronBeers every Friday 😜 ❤️ (the courses were so intensive ... we deserved beers 😅)My advice:Just make sure you start your pre-work ahead of time so you acquire some fundamentals before starting the bootcamp. Everything is on the Ironhack platform (beforehand, during and after bootcamp). I hope I helped you if you’re comparing bootcamps. Ironhack is an American school 🇺🇸 , a mix of a Business School and a military bootcamp: 😅 you’ll literally be ready for code-wars 🔫 😉 , not only you’ll feel like an Alumni but also kind of a Veteran 💪 🚀 🔥 . You can reach my on Linkedin if you have questions: https://www.linkedin.com/in/chakib-bachir/Read Less",ironhack
267263,Anonymous,1,"Software Engineering",2020,0,"Web developer","Una experiencia increíble,  muy intensa y donde se aprende muchísimo.",8/7/2020,2020-08-07,,4.7,5.0,5.0,4.0,"Los contras seria lo frustrado que te sientes muchos días o momentos, saberlos gestionar y no querer abandonar es lo mas difícil. Los pros es todo lo que aprendes en 9 semanas y el gran compañerismo que hay. Lo que ofrende Ironhack en esas 9 semanas es... Read More lo que esperaba, sales sabiendo muchísimas cosas de las cuales antes no tenias ni idea.Read Less",ironhack
267141,"Edgar Chavero",0,"Software Engineering",2020,0,"Full stack web developer","Amazing experience",8/3/2020,2020-08-03,"Web Development Bootcamp",5.0,5.0,5.0,5.0,"Great experience at Ironhack Mexico, the teachers are great helping you throughout the bootcamp, and so the rest of the staff. The full-time bootcamp is really hard to go by but everyone helps you to achieve your goal. Every Friday they have activities... Read More to socialize with the rest of the class and other groups which I think Is a great idea to integrate everyone at campusRead Less",ironhack
266915,Anonymous,1,"Software Engineering",2020,0,,"Excellent choice, great conditions, great staff and curriculum",7/29/2020,2020-07-29,"Web Development Part-Time",4.7,5.0,5.0,4.0,"I just finished the Web Development part-time course. The experience couldn't be more satisfying!I had excellent teachers (both lead as assistant) that were very well matched with the subjects and tireless in supporting the students.The environment gives... Read More you the chance to study, as well to socialize and develop all kinds of connections (social, academic and professional).There are academic events constantly being promoted, such as webinars, seminars and workshops that complement the curriculum and the learning experience.I have not yet gone through the carer week, however the school has been sending me preparation material and has been totally available to my questions.I could not be more pleased!Read Less",ironhack
266891,"Arturo Quiroz-Ramirez",0,"Data Analytics",2020,0,"Software Developer Jr., Data Analyst Jr., Structural engineering PhD.","It was challenging and great!!!!!",7/28/2020,2020-07-28,"Data Analytics Bootcamp",5.0,5.0,5.0,5.0,"Hi, I have to say that this was a quite nice full-time bootcamp at Ironhack (Mexico City)... For me, that I studied up to a PhD. in structural engineering, at the beginning felt that was going to be easy, BUT NOT!!!! It was challenging, I discovered a... Read More different way to make things work better. It was a cool group with people ready to help, from the advisors (like Anahí, Rocío and Pavel) up to the teachers (Yonatan and Oscar were always great and helpful). More than a review, I want to say to all of them THANK YOU!!! Hope in some moment near in the future, be able to take the Web Development one. Kind regards and I invite you to try Ironhack bootcamps. It's a great way to learn MORE THINGS tha only programming, it is a whole experience that deserves to be lived.Read Less",ironhack
266881,Anonymous,1,"Software Engineering",2020,0,"Graphic Designer","Amazing and intense experience!",7/28/2020,2020-07-28,"Web Development Part-Time",5.0,5.0,5.0,5.0,"I've just completed the Web Development part-time course in Lisbon and it was the best decision in my life! I loved the curriculum, loved the people and loved the support. I was excited for every class and I really feel I've developed so many awesome... Read More skills. I would advise joining Ironhack to anyone who would like to pursue this career. They really are the best!Read Less",ironhack
266677,"Lauren Todd",0,"UX/UI Design",2020,0,,"Ironhack will knock your socks off!",7/22/2020,2020-07-22,"UX/UI Design Bootcamp",5.0,5.0,5.0,5.0,"This program gave me an incredible foundation in UX Design, UI Design and Human-centered Design Thinking, as well as all the resources and support to keep learning after my program ended. By the end of the course, I felt confident about the design process,... Read More the tools and techniques that can be used and the value they provide in understanding users, as well as the fundamentals of good design. The teaching team are very passionate and patient - they want to share their knowledge and their enthusiasm for design is infectious!Pros:- Passionate, enthusiastic teaching staff who want you to do well and understand the material. They explain things really clearly and take time to make sure you understand the tools and value.- Hands on projects - you dive straight in and I think this is the best way to learn!- Mix of team and solo projects- So much encouragement- Coding lessons included so you get familiar with development- Introduced to a great and supportive community of alumni, current students, and design experts across the region- Opportunity to participate in meetups from top designers who are experts in their field- Whole week dedicated to career support, leveraging your past experience, and how to network effectivelyCons:- Would have liked a bit more of a heads up on which platforms were best for building a portfolio (it just took me a while to get my head around - may be easier if you've built a site before!)- Not really a con, but you get out what you put in. If you're expecting an easy ride, this isn't for you. This course is called an accelerated program for a reason - if you're willing to graft, put your whole energy into the curriculum and materials, you will reap so many more benefits!Read Less",ironhack
266459,"Joana Rita Martins",0,"UX/UI Design",2020,0,"Ux/Ui Designer","An online bootcamp super well organized.",7/16/2020,2020-07-16,,4.7,5.0,5.0,4.0,"I took the online Ux/Ui Design bootcamp at Ironhack, and though at first I was a little apprehensive then I was amazingly surprised with the experience. From the teachers, teacher assistants to all the team from Ironhack Lisbon, everyone made learning... Read More in these conditions the easiest job. Super well structured combined with an easy going environment. I really relate with Ironhacks methodology of teaching, much based on putting our learning’s straightway in practice. Although there is an amazing campus right on the river side with an amazing atmosphere, I don't regret at all taking the online experience. I came to this bootcamp with low knowledge on Ux/Ui Design and in just two months I feel ready and confident to start practicing it professionally.Read Less",ironhack
266455,"Rafael Bartolomeu Martins",0,"UX/UI Design",2020,0,"UX/UI Designer","Life Changing Programme",7/16/2020,2020-07-16,,4.7,5.0,5.0,4.0,"Ironhack is, by far, one of the most fascinating experiences I've ever had. I was in searching of a career reboot that could help me navigate through tech industry and since I was entrepreneur, I was in need of acquiring those hard skills that could help... Read More me become more independent and agile. At Ironhack, I found such a strong academic team that made sure we would learn as much as possible - extremely accessible, knowledgeable and most importantly, motivating. Teacher and students supported each other to go the extra mile and the results showed as every project had so much in depth content, it was awesome to see how much we could achieve in 9 weeks. In my case, the bootcamp was done remotely but Ironhack was more than ready and I the learning curve was massive (and as bonus, we learned how co-create digitally which is surely going to be a very important skill for years to come). In the end, I'm already working as a freelancer thanks to a contacts that Ironhack facilitated to me. Bonus: the campus is beautiful Pros: Strong Academic Team; Projects with Companies; Strong Network; Portfolio Development Cons: You need to be willing to endure a fast pace programme to keep up, but that's the deal :-)Read Less",ironhack
266454,"Susanne Aubert",0,"UX/UI Design",2020,0,"UX/UI Designer","A great learning experience",7/16/2020,2020-07-16,,4.7,5.0,5.0,4.0,"Ironhack was such a positive experience for me. I have nothing negative to say! But if I did I am sure they would take that into account and try to be even better - they really listen and value the opinions of their students and are always open to learning... Read More and improving. The community vibe is strong and the vibes are high and positive - you can do it! I loved every step of the way on this program. I feel super lucky to have such amazing and over qualified teachers that were very knowledgable on the subject, and at the same time inspiring and patient with us. This bootcamp is hard work, but you have great support through the whole process.Read Less",ironhack
266425,"Sofia Franek",0,"Software Engineering",2020,0,"Full Stack Developer","The question should be why aren’t you going to go to Ironhack.",7/15/2020,2020-07-15,"Web Development Bootcamp",5.0,5.0,5.0,5.0,"I attended Ironhack in Lisbon, January 2020. I already had previous experience as a developer so this was an opportunity for me to step my knowledge up and also get experience with back end technologies as well as front end. Choosing Ironhack was the... Read More best decision I made. There are many other boot camps around Europe but Ironhack takes everything a step further. The support from applying to completion and beyond is great. Regular check-ups making sure I’m on track with my goals and aspirations. You get to meet amazing people, all with different experiences that you can learn from and you build so many contacts that in the future you may find yourself working with them. The opportunities are endless after Ironhack. I would recommend this course to beginners or developers that have a few months to a year experience and want to jump up the career ladder faster!Read Less",ironhack
266341,Anonymous,1,"UX/UI Design",2020,0,"UX/UI Designer","An intensive  project based experience",7/13/2020,2020-07-13,"UX/UI Design Bootcamp",5.0,5.0,5.0,5.0,"I was part a the full-time UX/UI bootcamp in Paris. And I would recommend it to anybody who wants to learn the methodology of Design Thinking, the mindset of being a designer and who wants to start building a portfolio. This bootcamp is intense so you... Read More need to be 100% committed.In 10 weeks of time I got a strong base a theory, and practice, but what makes this different from an online course is that you learn much more because you're always working with the other students, like you'd do in a company, and you can have direct feedback from teachers at anytime.I did my bootcamp remotely during lock down, and it went super smoothly thanks to the effort of Ironhack team.So well done to IH for the good work.Ironhack is often doing partnership with brands to offer scholarship based on tests, take advantage of it ;)Read Less",ironhack
266294,"Nasser F",0,"Data Analytics",2020,0,"Software Engineer","Excelent Data Analytics Bootcamp",7/10/2020,2020-07-10,"Data Analytics Bootcamp",5.0,5.0,5.0,5.0,"The Data Analytics Bootcamp has met all my expectations, both in theory and practice. The focus of training is on practice rather than theory and is based on case-studies. The pedagogical team is very competent and the administrative team is very kind.... Read MoreRead Less",ironhack
266282,Anonymous,1,"Data Analytics",2020,0,"Software Engineer","Excellent BootCamp",7/9/2020,2020-07-09,,5.0,5.0,5.0,5.0,"This was the best learning experience that you can get on Data Analytics. There isn't anything that match's the dynamic team and the way they will give you strength to keep going specially when you hit a wall that at that time might appear to be something... Read More impossible to solve! It's a pleasure and an Honour to be apart of the IronHack Family!!Read Less",ironhack
266276,"Rebecca Norén",0,"Software Engineering",2020,0,UX-designer,"Kickstarted my programming skills",7/9/2020,2020-07-09,"Web Development Bootcamp",5.0,5.0,5.0,5.0,"As I UX Designer I’m in touch with programming and the recent years my interest has grown to learn more. I’ve tried to study by myself but found it hard to find time and to truly commit. After 3 years I finally decided to apply to join the Ironhack webdev... Read More bootcamp. And I’m so happy that I did! I’ve acquired skills which would have taken me a long time to teach myself.For someone who haven’t don’t a lot of coding the journey has been intense. I’ve spent a lot of time in front of the computer practicing and from time to time it really has been difficult. But the feeling of starting to understand more and more and being able to solve a difficult problem is truly amazing.I liked how theoretical knowledge was mixed with assignments, labs and projects. I had a lot of fun doing the project weeks and I finished 3 projects which I’m really proud of. The teacher and the teacher assistants has been really helpful and dedicated. They always took their time explaining difficult parts and reviewing my code when things didn’t work as expected. I’m really thankful for their devotion. To finish up, if you are thinking about joining a bootcamp – do it! You will be able to make it and you won’t regret learning new skills and meeting with amazing people.Read Less",ironhack
266264,William,0,"Software Engineering",2020,0,"Front-End Developer","Amazing choice if you're willing to deep dive into Web Development!",7/9/2020,2020-07-09,"Web Development Bootcamp",4.7,5.0,5.0,4.0,"In a nutshell: great staff, courses in English are a game-changer, very strong focus on projects and practice, fastest way to learn amazing skills.Joined the March 2020 cohort, right in the middle of the health crisis. Ironhack reacted accordingly by... Read More shifting the courses remotely, which went amazingly well. For the Full-Time course I strongly recommend devoting all of your time to the bootcamp as the rhythm gets quite intense. The classes cover all the basics from the very beginning and the more you study and practice, the more in depth you will go. Practicing being key to securing your skills, the learning isn't over at the end of the day. Taking some personal time to practice and review the lessons will really make a difference on the learning experience. Staff was amazing during my session: Lead teachers, Teacher Assistants and Management Staff are fully dedicated to bringing the best experience as possible. If you devote a fair amount of time to learning, you are definitely job-ready after the bootcamp.Read Less",ironhack
266263,"Camille Libert",0,"Data Analytics",2020,0,"Insights Project Manager","Great organisation and adaptability of the class during the Covid crisis - support from teacher and team",7/9/2020,2020-07-09,"Data Analytics Bootcamp",4.7,5.0,5.0,4.0,"Pros:- class organised with exercises, formal presentations and projects, on top of learning the tools. - Really prepares you for working in the industryCons:- A diploma that isn't recognized academically VS a masters, however it is a 2 months bootcamp!... Read MoreRead Less",ironhack
266037,Anonymous,1,"Data Analytics",2020,1,,"Great experience as expected :)",7/3/2020,2020-07-03,"Data Analytics Bootcamp",5.0,5.0,5.0,5.0,"Excellent choice to get introduced into Data Analytics. It's been only 4 weeks and the progress is exponential. I would recommend the bootcamp not only if you want to change your career path towards Data Analytics but also to acquire some hard skills... Read More use data in other roles / industries.Read Less",ironhack
266009,"Manon Philippe",0,"UX/UI Design",2020,0,Designer,"A very complete bootcamp !",7/2/2020,2020-07-02,"UX/UI Design Bootcamp",4.7,5.0,5.0,4.0,"I was unconvinced when I joined this formation but I quickly changed my mind! The teacher (Jérémie) was very competent, the courses very enriching and in addition we did the boot camp online. Ironhack has given us a lot of tools so that we can adapt according... Read More to our knowledge and ease. The Bootcamp combines theory and practice which is a big advantage because everything we learn we work on making projects. During these 9 weeks of Bootcamp we end up with 6 projects which is great because we have enough to make a portfolio to apply in companies at the end of the bootcamp. And the week bonus we learn to code to make our online portfolio was really great!Read Less",ironhack
265960,"Tim Stephens",0,"Software Engineering",2020,0,"full stack web developer/teacher","Hugely rewarding experience that gave me a job as a developer, a load of new friends, a better way of thinking and very warm welcome to a new city",7/1/2020,2020-07-01,"Web Development Bootcamp",4.7,5.0,4.0,5.0,"Pros: - Learning javascript to the level of a junior developer with around 12/18 months experience- Being part of an amazing ecosystem that is supportive, welcoming and very friendly - Very well curated cohorts Cons: - Extremely high pace. I wished I'd... Read More done a little more coding before hand to grasp the basics- Low focus on styling/cssRead Less",ironhack
265948,Anonymous,1,"UX/UI Design",2020,0,,"Me gustó, aprendí muchas cosas nuevas",6/30/2020,2020-06-30,"UX/UI Design Part-Time",4.0,4.0,4.0,4.0,"Mi experiencia en Ironhack fue muy buena, aprendí muchas cosas que hoy en día me han sido de utilidad para mi carrera profesional. Entiendo que es un curso en donde ves muchas cosas en muy poco tiempo, así que depende mucho de ti lo que quieras aprender... Read More y en los temas en lao que quieras o necesites ahondar, sin embargo, me parece que tocan lo mínimo necesario para hacer un cambio de carrera.Read Less",ironhack
265947,"Alberto Ibarra",0,"Data Analytics",2020,0,"Data Analyst","The best investment of time and money",6/30/2020,2020-06-30,"Data Analytics Bootcamp",5.0,5.0,5.0,5.0,"I wanted to make a career change for a while, but I did not know where to begin, I had the opportunity to dedicate 9 weeks to myself to learn something new with a deep level to make it professionally , that was what Ironhack did to my career in that short... Read More amount of time, I not only learned the foundations, but let me use that new knowledge into something real, all the time learning by doing, coding 8 to 12 hours per day, and solving any doubt as fast as it gets, but also learning how to solve that doubts by myself. After the course the career services had followed my progress to find a new job, and even some times thar job takes some time to happen, they have been with me the all way long, with tips, job offers, one-on-one advisory, group advisory, career fairs events, and all the necessary to find a new job in the tech industry. I'm very glad to had the opportunity to do this program, and I am absolutely convinced that this was my first strong step in my new career as Data Analyst / Data Scientist / Data EngineerRead Less",ironhack
265946,"Arturo Gabriel Alvarez Araujo",0,"Software Engineering",2020,0,"Frontend Developer","The decisive nine weeks in my life",6/30/2020,2020-06-30,"Web Development Bootcamp",4.7,5.0,4.0,5.0,"When I started I had faith in the course, but I never expected to get that far. It only took 9 weeks to learn to program at a good level. It was not easy, each day was a new challenge, without a doubt one of the most difficult challenges in my life, as... Read More well as the challenge that brought me the most benefits.If you want to add value to your career, learn to program or even give a total turn to your career. IRONHACK IS WITHOUT ANYTHING THE BEST OPTIONRead Less",ironhack
265832,"Maxime Ferret",0,"Software Engineering",2020,0,Growth,"A bootcamp that went beyond my expectations",6/26/2020,2020-06-26,"Web Development Bootcamp",4.7,5.0,5.0,4.0,"My pros:+ The content provided by Ironhack is by far the most pedagogic I've seen. It is well thought, teached and super easy to access thanks to their platform. The amount of content is really important and allows you to go further if you want.+ CARE:... Read More the teacher and the TAs were really caring about our wellbeing which could be really challenged during such experience, they had nice attentions and were really supportive. This is the one I wasn't expecting and that completely changed my vision of the bootcamp. Having that is completely game changer into your approach and the way you face those challenging weeks.+ The diversity of the materials, ways to work, collaborate, ways to learn new things is really the reality of how developers organize their job. Having the glimpse of the during the bootcamp is a must have to properly integrate a tech team.+ During those hard times of Covid19, the Ironhack team has been able to switch from a classical bootcamp to a remote bootcamp in few days without lowering the quality of it. They've provided a nice environment, made efforts to integrate everyone and in the end I've really enjoyed that special format.My cons:- The bootcamp is fast, so you have let it be the one and only thing on your agenda. It requires some organization on your hand that is not enough enhanced by the team.- Prices rises year by year and it is reaching an amount where you want to get everything that it promised (if you can afford it). The Job support doesn't match expectations people had before applying nor the reality of the market. That's fine because there are no miracles but the disappointment can be real for someone counting on getting a job fast at the price range teased.Read Less",ironhack
265809,"Teddy Rogers",0,"Software Engineering",2020,0,"web dev","Be ready to change your life !",6/25/2020,2020-06-25,"Web Development Bootcamp",4.7,5.0,5.0,4.0,"I joined the Boot Camp Ironhack with practically no knowledge of web development. Thanks to their pedagogy based on concrete practices, I acquired the bases necessary to create real web applications. The teaching is intense and you have to be motivated.... Read More Fortunately the team is there to help us and push us ever more. Ironhack teaches us that our creativity has no limits. We learn to learn and always stay curious about new technology. Ironhack gives us all the basics to look for in the workplace. Now that I have my degree, I can't wait to put everything I have learned to work for businesses.Read Less",ironhack
265788,"Guillaume de Glisezinski",0,"Software Engineering",2020,0,,"Great learning",6/24/2020,2020-06-24,"Web Development Bootcamp",5.0,5.0,5.0,5.0,"Great teaching and learning even with the exceptionnal circonstances.The teacher assistants help a lot too without interrompting the flow of the course.10 weeks are maybe a bit short to view all but nothing you can't do by searching on your side.Don't... Read More learn to be a fullstack developer, learn to be a developer (and search what you need to learn always more) !Read Less",ironhack
265738,"Brule Olivier",0,"Software Engineering",2020,0,,"Great experience",6/22/2020,2020-06-22,"Web Development Bootcamp",5.0,5.0,5.0,5.0,"It was a great, the teachers and teachers assistant are always here to help understand and give advices all the ironhack team give the best of themselves and are open minded to all critics to improve the experience and give to the students the best ways... Read More to learn and have fun learning.Read Less",ironhack
265732,"Sandra Giraldo",0,"UX/UI Design",2020,0,"UX/UI Designer","A challenging and rewarding Bootcamp experience",6/22/2020,2020-06-22,"UX/UI Design Bootcamp",5.0,5.0,5.0,5.0,"I was part of the March UX/UI Full Time Bootcamp at Ironhack Paris. During the three months of the bootcamp I was able to apply everything learnt throughout different projects which was very helpful when job interviewing after.I am very satisfied with... Read More the high quality of the program content, the overall learning process and the guidance and professionalism of the Ironhack Paris team.Thank you Ironhack :)Read Less",ironhack
265686,"Johnny Burke",0,"Software Engineering",2020,0,,"Web Dev Bootcamp",6/19/2020,2020-06-19,"Web Development Bootcamp",5.0,5.0,5.0,5.0,"I had an amazing experience at Ironhack. I finished the full-time web dev course in March 2020 in Berlin. The staff was amazing and I learned far more than I thought I would going into the program. I was a little nervous about my lack of experience as... Read More I had absolutely no coding background (I had never written one line of code prior to the course pre-work). I did not feel like I was left behind at all. My teacher and TA's were super helpful and really made sure everyone understood the course material. That said, you really have to do your part. If you put in the time to really understand the logic behind the code, you will be surprised how much you can learn in such a short time. I would recommend Ironhack to anyone looking to learn how to code.Read Less",ironhack
265682,Anonymous,1,"UX/UI Design",2020,0,,"Learning is your responsibility. They're just giving you the tools",6/19/2020,2020-06-19,"UX/UI Design Bootcamp",3.7,4.0,4.0,3.0,"I learned a bit from everything, but not in depth. The rest of knowledge-digging is on you. It is a strenous bootcamp so don't expect to be going out and partying on weekends.It is what you put in it. They are particularly strong in UX but a bit lacking... Read More in UI. Career week is a drag but useful for newcomers to the working class. I would recommend it if you're new to the field. TAs are awesome and teacher is very supportive.Read Less",ironhack
265629,"Noor El Samarani",0,"UX/UI Design",2020,0,"UX/UI Designer","Best decision I made",6/18/2020,2020-06-18,"UX/UI Design Bootcamp",5.0,5.0,5.0,5.0,"Joining Ironhack was the best decision I made to boost my career. Not only did I meet amazing and supportive people (students and instructors) but I also got the set of skills and mindset I needed in order to enter this field in full confidence. The course... Read More was challenging (being fully remote because of Covid19) but way better than expected. I learned a lot while making new friends and having fun at the same time.Read Less",ironhack
265583,"Baby Jessi Parker",0,"UX/UI Design",2020,0,Designer,"Insightful and challenging but also comfortable and rewarding.",6/17/2020,2020-06-17,"UX/UI Design Bootcamp",5.0,5.0,5.0,5.0,"Fantastic program with wonderful, supportive staff. I was part of their first remote cohort. They converted their entire curriculum in a week to accommodate the current restrictions of the pandemic. Throughout the entire program they constantly asked... Read More us for our feedback and adjusted to best help us learn.Read Less",ironhack
265505,Anonymous,1,"UX/UI Design",2020,0,"UX/UI Designer","Getting to know yourself",6/15/2020,2020-06-15,"UX/UI Design Bootcamp",5.0,5.0,5.0,5.0,"During this bootcamp I learned everything I needed to know about a UX UI Designer but especially how to put it into practice and how to work in an agile and freelance company.These applications in group, alone and the preparation work for the recruitment... Read More allowed me to know myself, to learn how to talk about my past and the future I wanted to move towards.Read Less",ironhack
265496,"Michael Gaeta",0,"Software Engineering",2020,0,"Software Engineer","Top-Tier Experience",6/15/2020,2020-06-15,"Web Development Bootcamp",5.0,5.0,5.0,5.0,"Ironhack undoubtedly stands out from other bootcamps because it prides itself on a 10/10 experience for each of their students.I was a student in one of the first remote cohorts due to Covid-19. I was surprised at how well things went in a remote environment.... Read More And the Ironhack team did a great job to make everything as comfortable as possible for us. Teachers and support staff were always available to listen and adapt quickly to our feedback.Throughout the program, I felt that every staff member was fully invested in my success. There were many times where things were difficult, but I was encouraged to continue and reach success with their support. That being said, material is quite overwhelming (this is a bootcamp, after all). You will need to fully commit and 'trust the process' (you will hear this a lot) to get the desired results.After the bootcamp, the career support program is also really useful, especially given the Covid-19 disruption to employment. If you are worried about that, my opinion is that I felt very safe in the hands of the outcomes manager to help me get a job as quickly as possible. If you are serious about taking a bootcamp, Ironhack is easily one of the best.Read Less",ironhack
265376,"Mathias Gautier",0,"Software Engineering",2020,0,"Web developer","Great experience enven in this difficult times",6/11/2020,2020-06-11,"Web Development Bootcamp",5.0,5.0,5.0,5.0,"I this this program is very good for people who want to fully commit to learning web dev, and maybe it can be more difficult for people who can't free their time during two full months. Beside that I really loved this experience and even though you can't... Read More learn everything in two months, it gives you a great and solid knowledge in order to start your web dev journey. Also we attented the program remotely due to the coronavirus situation and they reacted really fast so that we could maintain the classes. I think they did a great job at that and the team is really cool and supportive. So overall a great exeperience even though one more month would have been better.Read Less",ironhack
265370,"Ludivine Lacour",0,"Data Analytics",2020,0,"Data Analyst","Many learnings and great support from the Ironhack team",6/11/2020,2020-06-11,"Data Analytics Bootcamp",5.0,5.0,5.0,5.0,"I was part of the Data Analytics Paris' March bootcamp. It was the first online bootcamp due to covid-19 context and the Ironhack team did a great job to make everything as comfortable as possible for us. Teachers as well as support team were here to... Read More listen and adapted quickly to our feedback. I have learned a lot, the bootcamp was really intense but now I am more confident about my skills and I have many projects to present for my future job interviews. I was a bit skeptical to choose this bootcamp at first sight but today I truly recommend to go for it!Read Less",ironhack
265348,"Nelly Borjon-Piron",0,"Software Engineering",2020,0,,"Even better than huge expecations",6/10/2020,2020-06-10,"Web Development Bootcamp",5.0,5.0,5.0,5.0,"Pros :- Very professional and kind team and teachers, always here when needed. Extremely patient with all our questions and mistakes. I felt really supported.- Extremely good handling of the corona situation by switching in a remote class. They succeed... Read More to create a friendly atmosphere when the situation was not ideal.- So much learned in 9 weeks. It is amazing what we accomplished after only 9 weeks of lessons.- Still supporting us after the bootcamp to find a job.Cons:-So great that we are sad when it is overRead Less",ironhack
265336,"Sam Littlefair",0,"Software Engineering",2020,0,"Full-stack Web Developer","Ironhack is Intense and Incredible",6/10/2020,2020-06-10,"Web Development Bootcamp",5.0,5.0,5.0,5.0,"I attended Ironhack's March 2020 Bootcamp in Paris. The program started one week after the French government announced strict lockdown measures in response to COVID-19. The Ironhack team heroically moved the whole program online in a matter of days, and... Read More by the time we started class, it felt like the program was designed to be delivered online all along. The Ironhack staff made the online program feel human, natural, and comfortable. I had basic knowledge of most of the topics covered in the curriculum (mostly from a Udemy full-stack web development course), but I never got bored, and I was always busy. For the first few weeks of the program, everything I learned helped fortify and expand my prior knowledge. By the third week, things were getting quite tough. The curriculum is designed so that you are constantly learning, and that was my experience. At times it felt overwhelming, but in retrospect, everyone in the class learned an incredible amount even when the subject matter felt impenetrable.Read Less",ironhack
265333,"Camille Brodin",0,"UX/UI Design",2020,0,"UX/UI Designer","One of my best learning experience !",6/10/2020,2020-06-10,"UX/UI Design Bootcamp",5.0,5.0,5.0,5.0,"I successfully increase my employability thanks to Ironhack ! I’m currently starting a new career as a Freelance combining my two fields of expertise : HR + UX/UI Designer. The Bootcamp experience was intense, sometimes I thought to myself, I cannot make... Read More it … fortunately my classmates, teacher and TAs helped me overcome difficulties at every step. I learned so much from each on of my coworker.We started class in the beginning of the COVID-19 lockdown and for sure it was the best opportunity to boost my design capacity. Go for it !Read Less",ironhack
265331,"Florian Jomain",0,"Software Engineering",2020,0,"Full-stack Web Developer","About my amazing experience @ Ironhack",6/10/2020,2020-06-10,"Web Development Bootcamp",5.0,5.0,5.0,5.0,"I must say the bootcamp started out in the weirdest situation: quarantine had been announced just a few days before the beginning of the bootcamp and we had to decide if we wanted to follow the course fully remotely from home or postpone to a later cohort.... Read MoreI decided to stay, and never regreted.Ironhack's staff transitioned really fast to the remote learning setup and it was seamless. I know they are considering offering remote classes as a standard now, and I couldn't recommend it more. You get to spend more time on actually learning, and the group cohesion actually happened with a few activities that the staff organized.Apart from that, the program is really well structured. I was so happy to be learning JavaScript and not Ruby which I had considered before, the job market is really keen on JavaScript skills. It actually is a requirement for the job market in most jobs I find while looking for a job now.The program is complete, really advanced, very fast at times, but I must say I am happy about what I learned and actually learned way more than I thought I would before joining the course. My view is that it is the most "dev" oriented bootcamp. I've looked at the syllabus of other webdev bootcamps and they seemed better suited at Product Management or people curious about web development but not intending to go into the hardcore stuff. Ironhack really is techie and professional.Afterwards, we are being coached by a competent career coach who is following with us our progress. The alumni network is big and people still exchange and help each other after the bootcamp.I know it is an investment but I would definitely recommend the course if you plan on improving on digital skills or fully switch to being a developer.Read Less",ironhack
265276,"Lars Hansen",0,"Software Engineering",2018,0,"Full-stack web-developer","I got to pursue my passion and make life-long friends!",6/8/2020,2020-06-08,"Web Development Bootcamp",5.0,5.0,5.0,5.0,"My experience as a student and later help teacher in Ironhack was nothing short of amazing. As an added bonus, the beer is both cheaper than it was in Oslo (where I'm from) and better, and you get to share that beer with people that - even though you... Read More only study with them for 2 months - you will remember and know for the rest of your life. I am writing this review 2 years after finishing my bootcamp. One of the things I remember reading about (which I kind of doubted before starting) was the friendship everyone said you develop with co-participants, and how tight you become as a group. I was proven wrong. The Ironhack staff of Berlin almost forced us to become good friends! Now now, hear me out. After a first day of introduction games, name games and an already overwhelming amount of work, the participants would go out together and have a drink. And after a hard day's work (and on every Friday!) we would do the same. We had pair-programming everyday during classes and did independent projects in pairs or trios. The work is so intense, and you spend so much time with your peers, that by the time the first week is over, it will feel like you've already known the others for a long time. You end up with a sort of "us against the work"-mentality because of the sheer amount, where you just have to band together to beat the monster that is the Daily Exercise. I feel that I don't really need to say much about the effectiveness of Ironhack's teaching. I got a job after 1 month. I had zero prior coding skills, or even math skills, just an interest for gaming and technology. Most of my cohort got a job in way less time, many even before the camp ended. I got to be a help teacher after my bootcamp and can give a few tips, as some of the difficulties students had were similar in the next group. - Read up and get as good as you can before the bootcamp. I was not particularly well prepared (I would say average to below average skill level), and had to work that much more. Don't do what I did. Don't procrastinate the pre-work. The workload is massive, and "getting back on track" when you start off-track is really, really hard. - Additionally, go out with the other participants! Get a beer (or ten)! Switch places in the classroom! Say yes to all the outings and beers and lunches and whatnot. Remember that when you're done there, your skill level is only one part of the picture. Your network and friendships are the stuff you actually remember. And practially speaking, I now have multiple contacts within the tech industry from all around the world. So make it a good experience by having fun, and not drowning in the work, and it's a win-win.- Take some distance. Take at least one day off per week. Don't "use the weekend to get back on track" (you will say this at some point). You will need the time off in the long run, just trust me on that.Read Less",ironhack
265229,"David Colatti",0,"Software Engineering",2020,0,"Junior UI Developer","From Sales to Software Developer in 4 Months",6/4/2020,2020-06-04,,5.0,5.0,5.0,5.0,"At first I was in between 2 coding bootcamps in Miami however my friend, that works at Apple as a QA Engineer had told me to look into Ironhack. I never heard of them before, they were not the cheapest but I was not worried about price but I wanted to... Read More get the best experience out there. I did the full time cohort and it has changed my life forever. I was previous cold calling small businesses for a living for about 4 years and I quickly realized that I needed a valued skill that I can build on. I was highly interested in programming so I decided to pursue it full time! It was not easy.. the bootcamp was 400 hours however I put in well around 1000 hours into 9 weeks. It was so worth it! 4 months later, I am writing this but now have a great job position doing what I genuinely feel that I love doing, programming. The most important skill set I feel that I received the understanding how to learn and that it's okay to feel incapable even though you are completely capable. The staff was very easy to work with! Sometimes you have your doubts if they are really there for you to help but I understood that is just a way to make you use your brain and learn your self. I also felt some disorganization during enrollment however that was not the case as the admissions manager was actually replaced and they actually were very on top of their game! When I originally signed up for Ironhack Full Time Web Dev cohort I was very excited for the in person experience but then COVID hit and nobody was prepared. I had my doubts that I would learn anything but Ironhack over exceeded my expectations. It seemed as if they prepared since the beginning! Today, I would choose to do it all over again remotely compared to in person. I feel that I would have more time to code after classes since I am at home compared to making the commute and then later finding time to open my laptop again.The career week has been outstanding and tons of practical help to back you up with applying and finding your first position! I was fortunate enough to find a job even before the career week started but choose to do it anyways to better understand for future opportunities. Overall, coming from somebody with 0 technical background, I would highly recommend Ironhack to anybody that asks me. I would say it is NOT for the faint heart but a very lucrative investment for your future and the relationships with the Ironhack family is priceless. I am looking forward to the rest of my life and what is to come, all the credit it due to Ironhack Miami!Read Less",ironhack
265094,"Manuel Temido Rocha",0,"Software Engineering",2020,0,"Web Developer","The most intense and rewarding  learning experience.",5/30/2020,2020-05-30,"Web Development Bootcamp",5.0,5.0,5.0,5.0,"Ironhack gives you an amazing push to enter the tech world.In 9 weeks, if you are completely committed you will truly learn more then the basics to get a job and start giving value in no time.The technologies that you will learn are always the top used... Read More in the market and updates as so.The learning experience has always in mind a practical view and in touch with the market reality and needs.The environment is incredibly friendly.I finished the bootcamp when the covid situation scaled and even in this situation I got my job in exactly two months.Read Less",ironhack
264592,"Gustavo Jordão",0,"Software Engineering",2020,0,"Product Manager","Great place to learn real skills!",5/14/2020,2020-05-14,"Web Development Part-Time",5.0,5.0,5.0,5.0,"Hi everyone,Recent grad from Ironhack Miami here as a Web Dev. I gotta say that when I read the reviews and joined Ironhack, I didn't know that, much beyond learning actual applicable skills and knowledge, I've been introduced to a new world of possibilities.... Read More The Ironhack team went above and beyond to show us real-world techniques, problems and their solutions, and much more. I've been fortunate enough to land a job even before graduating, and recommend this bootcamp for anyone looking for one!Read Less",ironhack
264578,"Daniela Santos Ferreira",0,"UX/UI Design",2020,0,"UX/UI Designer","IRONHACK LISBON - UX/UI DESIGNER",5/14/2020,2020-05-14,"UX/UI Design Part-Time",4.7,5.0,5.0,4.0,"I finished my bootcamp at the end of March. I was part of the first UX/UI Designer part-time squad at Lisbon and in the end I continued with the feeling that it was the best decision of my life. The decision to choose Ironhack to change my career proved... Read More to be right because I found a community like I never found elsewhere. The staff is very concerned with the student's well-being, providing him with the best possible experience with the balance between fun activities and learning. The course is intense and practical, allowing you to enter the job market with solid knowledge. I am proud to be an Ironhacker.Read Less",ironhack
264415,"Mykola M",0,"Data Analytics",2020,0,,"Iron out the data",5/9/2020,2020-05-09,"Data Analytics Bootcamp",5.0,5.0,5.0,5.0,"Most important thing to keep in mind when you're looking at bootcamp-type education - your attitude and ability to persevere.It will be tough, at times it'll feel like too much, you will wish for extra 10 hours in a day, etc. But it's all going to be... Read More fine, just keep at it.As to the Ironhack specifically, I'm glad I was part of it. Teacher and assistants always there to help, even if you have the dumbest question. Curriculum is what you would expect from a bootcamp - intense, lots of things, lots of immediate application of what you've learned. Job support is good, they facilitate lots of connections and open data to connect you with potential employers, explain how to do CVs, cover letters, social networks, etc. If you've never did that, or not sure how to approach job hunting in IT, don't pass on their help here.Overall great stuff, Jan2020 cohort thanks for everything :)Read Less",ironhack
264332,"Neha Khachhibhoya",0,"Software Engineering",2020,0,,"Great experience, amazing and supportive :).",5/7/2020,2020-05-07,"Web Development Bootcamp",5.0,5.0,5.0,5.0,"I am utterly amazed by how much we can learn in 9 weeks. The curriculum is so eloquently designed that the people with no prior programming knowledge can become a full-stack web developer in 9 weeks. Ironhack has some of the most talented and experienced... Read More teachers and very knowledgeable TAs. They answered each question no matter how trivial they were. I am so grateful for our lead teacher and the TAs for their support, who were willing to work extra hours to guide us on every step and explain the difficult topics. Also, I respect their patience while working with our projects and whenever we were stuck in some nasty bug.Ironhack has the most thoughtful curriculum, with plenty of exercises and assignments. We were also introduced to pair programming which helped us to collaborate with others and become familiar with version control. Even though the Bootcamp can be really rigorous and challenging, the teacher and the TAs always found a way to make it interesting.Ironhack, in general, is a really supportive community. After we are done with the Bootcamp, they also teach us how to tackle an interview and provide all the resources needed to land a job. They also organize hiring fairs where companies participate to hire graduates. In addition to that, they also organize programs where external professionals come to give a talk about certain topics. They are also generous to give scholarships to the students. In my case, they were generous enough to provide me with the full scholarship and all the other expenses. Hence, I am eternally grateful to Ironhack.Having said that it is indeed very intensive and challenging Bootcamp but the end result and how much you have learned will be well worth it.Read Less",ironhack
264225,Alfonso,0,"Software Engineering",2019,0,"Full-stack developer","One of the best things I have done so far",5/4/2020,2020-05-04,"Web Development Bootcamp",5.0,5.0,5.0,5.0,"Joining Ironhack was one of the best things i haver done in my life.I was very lucky of the teachers and TAs I had during my bootcamp. The Leadteacher will listen to all of the students needs and will try to adapt to all of the lectures to us. TAs will... Read More always there for support some even stayed late hours during the night to help us finish our projects.The whole atmosphere is super healthy and friendly. Cannot complain at all.Read Less",ironhack
264218,"Clara Besset",0,"Software Engineering",2019,0,"Front End Developer","Life changing",5/4/2020,2020-05-04,"Web Development Bootcamp",5.0,5.0,5.0,5.0,"Ironhack was an amazing experience for me. I finished the Full-Time Web Dev bootcamp in Paris in August 2019, and I would recommend it for anyone looking for a career switch. I came from a social sciences background, and there is no need for any knowledge... Read More in this department before you join the bootcamp. It is quite intense but going through it with classmates makes it easier. The Lead Teacher and the TAs are super knowledgeable and patient, they know what you're going through and do their best to help you along. Our Program Manager did a fantastic job as well, and was present if we had any personal issues or concerns, and needed help dealing with the fast-paced learning environment. Having regular check-ins with the staff was great as well as this can be quite a roller coaster! Overall, be ready to work hard, but these months will surely be transformative and an experience to remember. I found a job as a Front End Developer shortly after I left Ironhack, it surely was one of the best decisions I made.Read Less",ironhack
264143,"Maruxa Moreira",0,"UX/UI Design",2018,0,"UX/UI Designer","Great Experience",5/2/2020,2020-05-02,"UX/UI Design Part-Time",5.0,5.0,5.0,5.0,"Enriching experienceWhen I started Ironhack I had no idea how enriching the experience was going to be. Changing a professional profile was a necessity for me but also something that scared me. In Ironhack my fears were cleared, I learned many things... Read More professionally and about myself, becoming a great experience from all points of view.Both lead teacher and TA are great professionals who all times help you in a personalized way. Learning from the point of view of working in Group or personal projects, presenting them to colleagues, etc. are a way to fix concepts acquiring knowledge in the same way that will be done working in a company.But one of the great wonders of Ironhack besides the day-to-day Bootcamp is that once it's over, it doesn't end the experience. The great support and support during the job search makes you always feel safe and helps to make the best decision when deciding your job destination.Before I finish, I also want to emphasize the great companionship between the "ironhacker" during and after the Bootcamp, they always support you and teach you a lot.Read Less",ironhack
264142,Anonymous,1,"UX/UI Design",2019,0,,"Skip the UI UX course if you have a better alternative",5/2/2020,2020-05-02,"UX/UI Design Bootcamp",1.7,2.0,2.0,1.0,"I attended the bootcamp in Barcelona. Even going into the course, I knew that it would not be worth the 7000eur I was paying. The students were ready to give a lot toward the course, unfortunately, the teacher and TAs were not. I was dismayed to find... Read More out that the course teacher used to previously teach coding at a different academy. Because of this, we got zero intro on even the basics of UI, other than a vague introduction to color theory. There was only a passing mention of material design and design systems. Now I work as a UI UX designer, after 6 months of trying to find a job. I work solely on UI, which is what any entry level designer will be expected to do. During the course, we also focused on learning to code, which- sure was useful but did not need to be a priority in the short 2 month course. A lot of the coding teaching was done by the TA, who was quite a nice person but definitely not suited for teaching. Which bring me to how Ironhack also pumps up its employment percentage. It employs its students from previous courses as its TAs. This is unfair, I would hope that TAs would atleast have a 1year experience as a UI UX designer. Overall, its a fun environment and I made some great friends. In terms of learning, I did most of it myself after I graduated. Don't take this overpriced course if you have an alternative/cant afford it. I have been learning a lot on SuperHi,which I think is a pretty good alternativeRead Less",ironhack
264076,"Lenon Guimarães",0,"Data Analytics",2020,0,,Disruptiva,4/30/2020,2020-04-30,"Data Analytics Part-Time",5.0,5.0,5.0,5.0,"Pontos positivos: Professores com alto conhecimento da matéria, suporte todo o tempo, infraestrutura da escola muito boa, muitas interações com outras turmas e o fato de realizarmos algumas atividades com outras turmas de outros cursos como por exemplo... Read More de UX.Pontos negativos: A hiring week é muito cansativo e pouco produtiva, não tivemos muitas informações sobre as pessoas e as empresas e como estaria disposto o ciclo de entrevistas. Por ser muito extenso, tive o sentimento de que as empresas estavam cansadas de entrevistar e em alguns casos as empresas demonstravam que não estavam muito interessadasRead Less",ironhack
264071,"Mathilde Habib",0,"Data Analytics",2020,0,"Data Analyst","Great experience",4/30/2020,2020-04-30,"Data Analytics Bootcamp",5.0,5.0,5.0,5.0,"I really enjoyed my experience at Ironhack for so many reasons. The first and most important (I guess) is the quality of what I've learned there ; it was very rich in term of curriculum and very intense. They provided in a small amount of time all the... Read More knowledge that we needed to start a new career. They teach us to be autonomous and find solutions on our own.Also the ambiance was very nice, the teachers and the classmatea were awesome.And they help us after all that to find a job. They don't leave us on our own when it's time to find a jobThanks for allRead Less",ironhack
264067,Anonymous,1,"Data Analytics",2020,0,"Data Analytics Student","The boot camp was really rewarding; I went from not knowing anything about coding to working on projects with an external client!",4/30/2020,2020-04-30,"Data Analytics Bootcamp",4.7,5.0,5.0,4.0,"I went in not really knowing how to code, so the fact that the teachers spent a lot of time covering coding fundamentals and theory was great! We were also given around 60 hours of work to complete prior to the first day of class, meaning that it was... Read More easier to hit the ground running when we arrived.There were weekly projects and this was a great way to consolidate all of the learning from that week. Doing weekly projects was also a great way to build up a portfolio on GitHub. The boot camp was quite fast paced but that is to be expected. The teachers made themselves very approachable outside of class time to help people catch up on topics they may have fallen behind on. The amount that each individual learns is largely based upon their own willingness to put in time and effort.I cannot comment on job support because I was not recruiting for a job. However, it appeared to me that a lot of support was offered and a lot of effort was made to prepare students for the recruitment process. I was very impressed that some of my classmates were able to quickly find jobs despite the global uncertainty which unfolded in March 2020.Read Less",ironhack
264046,"Julia Ramos Guedes",0,"Software Engineering",2019,0,"Software Engineer","Best study experience",4/29/2020,2020-04-29,"Web Development Part-Time",5.0,5.0,5.0,5.0,"The bootcamp literally changed my life for good.After 6 months of intense study, without knowing anything about web development, I became a software engineer at a large company. Ironhack helped me to develop soft and hard skills to be a good junior web... Read More developer and start my career.Honestly, when the bootcamp starts, I didn’t think that I would feel ready to work when it was finished, but surprisingly it worked. Thanks to Ironhack's methodology.Read Less",ironhack
264045,Anonymous,1,"Software Engineering",2020,0,,10/10,4/29/2020,2020-04-29,,4.7,5.0,5.0,4.0,"I would highly recommend Ironhack. This relatively short time of extensive learning completely changed the way I think of my capabilities. The course not only provided training with most in-demand languages but also made sure you can use everything in... Read More practice. The group that I belong to was quite big, however, there was always someone to help out with any problem. Apart from one Leading Teacher, we were supported by four Teacher Assistants. The atmosphere created by everyone at Ironhack made me feel like part of their family. This feeling of support and very friendly approach made it easier through the hardest moments of the Bootcamp. And there were few of them. Each module (1 module = 3 weeks) has a project assignment based on what we learned so far. Those were usually the most challenging, yet very satisfying weeks (last week of the module = project week). None forgot that we need some time to have fun and relax as well. There were lots of other things organized after or between classes (game nights, yoga, quiz sessions or simply having drinks at the end of the week). To summarize, I have never thought I would be able to achieve so much in such a short time. Ironhack's team did everything to make sure of that.Read Less",ironhack
264040,Anonymous,1,"Data Analytics",2020,0,"Data Analyst","Fast paced, good overall introduction to Data Science. Great support.",4/29/2020,2020-04-29,"Data Analytics Bootcamp",5.0,5.0,5.0,5.0,"As any bootcamp, everything was taught very quickly but I feel I have had the opportunity to learn about the main subjects in Data Science. The content regarding data engineering subjects was little, though.The bootcamp is very hands-on and the Ironhack... Read More team was always there to support me whenever I needed it, from teachers to the facilities manager. I also liked how they take feedback seriously and are not afraid of change if that means improvement.I don't have a background in a numerical field so statistics was specially hard, specially when taught at that pace. I think Ironhack should maybe evaluate the level of each student before the bootcamp starts and give them tailored pre-course material.Read Less",ironhack
264026,Deepika,0,"Data Analytics",2020,0,"Data Analyst","Great bootcamp",4/29/2020,2020-04-29,"Data Analytics Bootcamp",4.7,5.0,4.0,5.0,"Short but attained all possible information needed to know how to become intermediate in Python. The teaching was great, the teaching assistants were very helpful and the cohort was very well integrated in general. One can expect to attain good data analytics... Read More skills for sure after this bootcamp.Read Less",ironhack
